{
  "schema": "modu.solvable.v1.1",
  "problem_id": "S3_elem_3_008713",
  "problem_type": "sequence_ordering",
  "inputs": {
    "total_ticks": 3,
    "target_label": "Correct option",
    "target_ticks": 1,
    "target_count": 1,
    "unit": ""
  },
  "given": [
    {
      "ref": "obj.step.g1",
      "value": "A"
    },
    {
      "ref": "obj.step.g2",
      "value": "B"
    },
    {
      "ref": "obj.step.g3",
      "value": "C"
    }
  ],
  "target": {
    "ref": "answer.target",
    "type": "choice_number"
  },
  "method": "sequence_matching",
  "plan": [
    "Follow the explanation to verify the correct sequence of steps.",
    "Find the choice that matches the order."
  ],
  "steps": [
    {
      "id": "step.1",
      "expr": "B → C → A",
      "value": 2
    }
  ],
  "checks": [
    {
      "id": "check.1",
      "expr": "Option ② = B, C, A",
      "expected": 2,
      "actual": 2,
      "pass": true
    }
  ],
  "answer": {
    "blanks": [],
    "choices": [],
    "answer_key": [],
    "target": {
      "type": "choice_number",
      "description": "Correct option for circle drawing order"
    },
    "value": 2,
    "unit": ""
  }
}
