{
  "schema": "modu.solvable.v1.1",
  "problem_id": "S3_초등_3_008682",
  "problem_type": "geometry_construction_term_selection",
  "inputs": {
    "total_ticks": 2,
    "target_label": "지혜",
    "target_ticks": 1,
    "target_count": 1,
    "unit": ""
  },
  "given": [
    {
      "ref": "obj.large_circle",
      "value": {
        "radius_cells": 4
      }
    },
    {
      "ref": "obj.small_circle.left",
      "value": {
        "radius_cells": 2
      }
    },
    {
      "ref": "obj.small_circle.right",
      "value": {
        "radius_cells": 2
      }
    }
  ],
  "target": {
    "ref": "answer.target",
    "type": "selected_person"
  },
  "method": "term_matching",
  "plan": [
    "큰 원의 반지름과 작은 원의 지름을 모눈 칸 수로 확인한다.",
    "작은 원에서 큰 원의 반지름과 같은 값을 설명한 사람(지혜)을 고른다."
  ],
  "steps": [
    {
      "id": "step.1",
      "expr": "큰 원의 반지름",
      "value": "4칸"
    },
    {
      "id": "step.2",
      "expr": "작은 원의 지름",
      "value": "4칸"
    },
    {
      "id": "step.3",
      "expr": "알맞은 설명을 하는 사람 선택",
      "value": "지혜"
    }
  ],
  "checks": [
    {
      "id": "check.1",
      "expr": "작은 원의 지름이 큰 원의 반지름과 같은가",
      "expected": "지혜",
      "actual": "지혜",
      "pass": true
    }
  ],
  "answer": {
    "blanks": [],
    "choices": [
      {
        "id": "choice.1",
        "label": "1",
        "text": "민수",
        "source_refs": []
      },
      {
        "id": "choice.2",
        "label": "2",
        "text": "지혜",
        "source_refs": []
      }
    ],
    "answer_key": [
      {
        "id": "choice.2",
        "value": "지혜"
      }
    ],
    "target": {
      "type": "selected_person",
      "description": "알맞은 설명을 하는 사람"
    },
    "value": "지혜",
    "unit": "",
    "presentation": {
      "mode": "choice",
      "editor_managed": true,
      "review": {
        "mode": "choice",
        "status": "verified",
        "note": "",
        "answers": [
          {
            "value": "지혜"
          }
        ],
        "choices": [
          {
            "id": "choice.1",
            "text": "민수",
            "correct": false,
            "label": "1",
            "sourceRefs": []
          },
          {
            "id": "choice.2",
            "text": "지혜",
            "correct": true,
            "label": "2",
            "sourceRefs": []
          }
        ]
      }
    }
  }
}
