{
  "schema": "modu.solvable.v1.1",
  "problem_id": "S3_elem_3_008631",
  "problem_type": "multiple_choice_division",
  "inputs": {
    "total_ticks": 69,
    "target_label": "몫",
    "target_ticks": 3,
    "target_count": 1,
    "unit": ""
  },
  "given": [
    {
      "ref": "obj.dividend",
      "value": 69
    },
    {
      "ref": "obj.divisor",
      "value": 3
    },
    {
      "ref": "obj.options",
      "value": [
        21,
        22,
        23,
        24,
        25
      ]
    }
  ],
  "target": {
    "ref": "answer.target",
    "type": "division_quotient"
  },
  "method": "division_value_selection",
  "plan": [
    "69を3で割った商を求めます。",
    "選択肢から計算結果と同じ数を探します。"
  ],
  "steps": [
    {
      "id": "step.1",
      "expr": "69 ÷ 3",
      "value": 23
    },
    {
      "id": "step.2",
      "expr": "보기에서 23 찾기",
      "value": 3
    }
  ],
  "checks": [
    {
      "id": "check.1",
      "expr": "23 × 3 = 69",
      "expected": 69,
      "actual": 69,
      "pass": true
    }
  ],
  "answer": {
    "blanks": [],
    "choices": [
      {
        "id": "choice.1",
        "label": "①",
        "text": "21",
        "slot_id": "slot.choice.1.value",
        "source_refs": [
          "slot.choice.1.marker",
          "slot.choice.1.value"
        ]
      },
      {
        "id": "choice.2",
        "label": "②",
        "text": "22",
        "slot_id": "slot.choice.2.value",
        "source_refs": [
          "slot.choice.2.marker",
          "slot.choice.2.value"
        ]
      },
      {
        "id": "choice.3",
        "label": "③",
        "text": "23",
        "slot_id": "slot.choice.3.value",
        "source_refs": [
          "slot.choice.3.marker",
          "slot.choice.3.value"
        ]
      },
      {
        "id": "choice.4",
        "label": "④",
        "text": "24",
        "slot_id": "slot.choice.4.value",
        "source_refs": [
          "slot.choice.4.marker",
          "slot.choice.4.value"
        ]
      },
      {
        "id": "choice.5",
        "label": "⑤",
        "text": "25",
        "slot_id": "slot.choice.5.value",
        "source_refs": [
          "slot.choice.5.marker",
          "slot.choice.5.value"
        ]
      }
    ],
    "answer_key": [
      {
        "id": "choice.3",
        "value": "23"
      }
    ],
    "target": {
      "type": "division_quotient",
      "description": "69 ÷ 3의 몫"
    },
    "value": 23,
    "unit": ""
  }
}
