{
  "schema": "modu.solvable.v1.1",
  "problem_id": "S3_초등_3_008667",
  "problem_type": "geometry_point_selection",
  "inputs": {
    "total_ticks": 0,
    "target_label": "ㄴ",
    "target_ticks": 0,
    "target_count": 1,
    "unit": ""
  },
  "given": [
    {
      "ref": "obj.circle",
      "value": {
        "type": "circle"
      }
    },
    {
      "ref": "obj.point_g",
      "value": {
        "label": "ㄱ",
        "role": "candidate"
      }
    },
    {
      "ref": "obj.point_n",
      "value": {
        "label": "ㄴ",
        "role": "candidate_center"
      }
    },
    {
      "ref": "obj.point_d",
      "value": {
        "label": "ㄷ",
        "role": "candidate"
      }
    },
    {
      "ref": "obj.point_r",
      "value": {
        "label": "ㄹ",
        "role": "candidate"
      }
    },
    {
      "ref": "obj.point_m",
      "value": {
        "label": "ㅁ",
        "role": "candidate"
      }
    }
  ],
  "target": {
    "ref": "answer.target",
    "type": "selected_label"
  },
  "method": "center_identification",
  "plan": [
    "원 안의 후보 점들 중 중심에 해당하는 점을 찾는다."
  ],
  "steps": [
    {
      "id": "step.1",
      "expr": "원에서 가장 안쪽에 있는 후보 점을 확인한다.",
      "value": "ㄴ"
    }
  ],
  "checks": [
    {
      "id": "check.1",
      "expr": "선택한 점이 원의 중심인가?",
      "expected": "ㄴ",
      "actual": "ㄴ",
      "pass": true
    }
  ],
  "answer": {
    "blanks": [],
    "choices": [
      "ㄱ",
      "ㄴ",
      "ㄷ",
      "ㄹ",
      "ㅁ"
    ],
    "answer_key": [
      "ㄴ"
    ],
    "target": {
      "type": "selected_label",
      "description": "원의 중심으로 선택할 점"
    },
    "value": "ㄴ",
    "unit": ""
  }
}
