{
  "schema": "modu.solvable.v1.1",
  "problem_id": "S3_초등_3_008642",
  "problem_type": "conceptual_choice",
  "inputs": {
    "total_ticks": 0,
    "target_label": "한 원에 지름을 몇 개 그을 수 있는지",
    "target_ticks": 0,
    "target_count": 0,
    "unit": ""
  },
  "given": [
    {
      "ref": "obj.circle",
      "value": {
        "type": "circle"
      }
    },
    {
      "ref": "obj.center",
      "value": {
        "type": "center"
      }
    },
    {
      "ref": "obj.diameter",
      "value": {
        "count": "multiple"
      }
    }
  ],
  "target": {
    "ref": "answer.target",
    "type": "choice"
  },
  "method": "definition_check",
  "plan": [
    "지름의 정의를 확인한다.",
    "한 원에 그을 수 있는 지름의 개수를 판단한다.",
    "보기와 일치하는 선택지를 고른다."
  ],
  "steps": [
    {
      "id": "step.1",
      "expr": "지름은 원의 중심을 지나고 원 위의 두 점을 잇는 선분이다.",
      "value": "definition"
    },
    {
      "id": "step.2",
      "expr": "원의 중심을 지나는 방향은 여러 가지가 가능하다.",
      "value": "multiple"
    },
    {
      "id": "step.3",
      "expr": "따라서 한 원에 지름은 무수히 많이 그을 수 있다.",
      "value": "무수히 많이"
    }
  ],
  "checks": [
    {
      "id": "check.1",
      "expr": "지름이 중심을 지나는가",
      "expected": true,
      "actual": true,
      "pass": true
    },
    {
      "id": "check.2",
      "expr": "선택지가 정의와 일치하는가",
      "expected": "무수히 많이 그을 수 있습니다.",
      "actual": "무수히 많이 그을 수 있습니다.",
      "pass": true
    }
  ],
  "answer": {
    "blanks": [],
    "choices": [],
    "answer_key": [],
    "target": {
      "type": "choice",
      "description": "한 원에 지름을 몇 개 그을 수 있는지에 대한 알맞은 선택지"
    },
    "value": 0,
    "unit": ""
  }
}
