{
  "schema": "modu.solvable.v1.1",
  "problem_id": "S3_초등_3_008795",
  "problem_type": "단위선택",
  "inputs": {
    "total_ticks": 2,
    "target_label": "욕조의 들이 단위",
    "target_ticks": 1,
    "target_count": 1,
    "unit": ""
  },
  "given": [
    {
      "ref": "obj.bathtub",
      "value": {
        "name": "욕조",
        "quantity_kind": "volume"
      }
    },
    {
      "ref": "obj.unit_ml",
      "value": {
        "name": "mL"
      }
    },
    {
      "ref": "obj.unit_l",
      "value": {
        "name": "L"
      }
    }
  ],
  "target": {
    "ref": "answer.target",
    "type": "unit_choice"
  },
  "method": "생활용기-단위판단",
  "plan": [
    "그림이 나타내는 물건이 큰 용량의 생활용기인지 살핀다.",
    "보기의 두 단위 mL와 L 중 더 알맞은 들이 단위를 고른다."
  ],
  "steps": [
    {
      "id": "step.1",
      "expr": "욕조는 큰 용량의 생활용기이다.",
      "value": "욕조"
    },
    {
      "id": "step.2",
      "expr": "큰 용량의 들이 단위는 L이다.",
      "value": "L"
    }
  ],
  "checks": [
    {
      "id": "check.1",
      "expr": "욕조에 맞는 들이 단위를 고르는가",
      "expected": "L",
      "actual": "L",
      "pass": true
    }
  ],
  "answer": {
    "blanks": [],
    "choices": [],
    "answer_key": [],
    "target": {
      "type": "unit_choice",
      "description": "욕조의 알맞은 들이 단위"
    },
    "value": "L",
    "unit": ""
  }
}
