{
  "schema": "modu.solvable.v1.1",
  "problem_id": "S3_초등_3_008644",
  "problem_type": "geometry_circle_radius_selection",
  "inputs": {
    "total_ticks": 0,
    "target_label": "원의 반지름",
    "target_ticks": 0,
    "target_count": 3,
    "unit": ""
  },
  "given": [
    {
      "ref": "obj.center.O",
      "value": {
        "label": "ㅇ",
        "role": "center"
      }
    },
    {
      "ref": "obj.circle",
      "value": {
        "type": "circle",
        "center": "ㅇ"
      }
    }
  ],
  "target": {
    "ref": "answer.target",
    "type": "multiple_choice_selection"
  },
  "method": "definition_match",
  "plan": [
    "원의 중심 ㅇ와 원 위의 한 점을 이은 선분을 찾는다.",
    "해당하는 보기를 모두 고른다."
  ],
  "steps": [
    {
      "id": "step.1",
      "expr": "중심 ㅇ가 포함된 선분 확인",
      "value": [
        "ㅇㄴ",
        "ㅇㄷ",
        "ㅇㅁ"
      ]
    },
    {
      "id": "step.2",
      "expr": "원 위의 점과 중심 ㅇ를 이은 선분 확인",
      "value": [
        "나",
        "다",
        "라"
      ]
    }
  ],
  "checks": [
    {
      "id": "check.1",
      "expr": "선택한 보기 모두가 반지름의 정의에 맞는가",
      "expected": [
        "나",
        "다",
        "라"
      ],
      "actual": [
        "나",
        "다",
        "라"
      ],
      "pass": true
    }
  ],
  "answer": {
    "blanks": [],
    "choices": [
      "가",
      "나",
      "다",
      "라",
      "마",
      "바"
    ],
    "answer_key": [
      "나",
      "다",
      "라"
    ],
    "target": {
      "type": "multiple_choice_selection",
      "description": "원의 반지름인 선분을 모두 고르기"
    },
    "value": "나, 다, 라",
    "unit": ""
  }
}
