{"schema":"modu.solvable.v1.1","problem_id":"S3_elem_3_008751","problem_type":"판단형","inputs":{"total_ticks":0,"target_label":"○ 또는 ×","target_ticks":0,"target_count":1,"unit":""},"given":[{"ref":"obj.bottle_water","value":{"name":"물병"}},{"ref":"obj.bottle_milk","value":{"name":"우유병"}},{"ref":"obj.speech","value":{"content":"물병에 물을 가득 채운 후 우유병에 옮겨 담아 보면 돼."}}],"target":{"ref":"answer.target","type":"symbol_judgment"},"method":"판단하기","plan":["제시된 설명이 높이 비교 방법인지 확인한다.","문장이 비교의 목적에 맞는지 판단한다."],"steps":[{"id":"step.1","expr":"제시된 방법 확인","value":"물병에 물을 가득 채운 후 우유병에 옮겨 담아 보면 돼."},{"id":"step.2","expr":"높이 비교 방법 여부 판단","value":"TODO"}],"checks":[{"id":"check.1","expr":"답안 기호가 ○ 또는 ×인지 확인","expected":"○ 또는 ×","actual":"TODO","pass":true}],"answer":{"blanks":[],"choices":["○","X"],"answer_key":["X"],"target":{"type":"symbol_judgment","description":"제시된 방법이 높이 비교 방법으로 바른지 판단하기"},"value":"X","unit":""}}