{
  "schema": "modu.solvable.v1.1",
  "problem_id": "S3_초등_3_008840",
  "problem_type": "comparison_selection",
  "inputs": {
    "total_ticks": 3,
    "target_label": "가장 무거운 것",
    "target_ticks": 1,
    "target_count": 13,
    "unit": "개"
  },
  "given": [
    {
      "ref": "obj.count.glasses",
      "value": 5
    },
    {
      "ref": "obj.count.wallet",
      "value": 9
    },
    {
      "ref": "obj.count.mirror",
      "value": 13
    }
  ],
  "target": {
    "ref": "answer.target",
    "type": "selected_item"
  },
  "method": "compare_counts",
  "plan": [
    "세 물건의 공기돌 수를 비교합니다.",
    "가장 큰 수에 해당하는 물건을 찾습니다."
  ],
  "steps": [
    {
      "id": "step.1",
      "expr": "13 > 9 > 5",
      "value": true
    },
    {
      "id": "step.2",
      "expr": "가장 큰 수 13개에 해당하는 물건",
      "value": "손거울"
    }
  ],
  "checks": [
    {
      "id": "check.1",
      "expr": "선택한 물건의 공기돌 수가 가장 큰가?",
      "expected": 13,
      "actual": 13,
      "pass": true
    }
  ],
  "answer": {
    "blanks": [],
    "choices": [],
    "answer_key": [],
    "target": {
      "type": "selected_item",
      "description": "가장 무거운 것"
    },
    "value": "손거울",
    "unit": ""
  }
}
