{
  "schema": "modu.solvable.v1.1",
  "problem_id": "S3_초등_3_009009",
  "problem_type": "선의 종류",
  "inputs": {
    "total_ticks": 0,
    "target_label": "반직선",
    "target_ticks": 0,
    "target_count": 1,
    "unit": ""
  },
  "given": [
    {
      "ref": "obj.point_giyeok",
      "value": "ㄱ"
    },
    {
      "ref": "obj.point_nieun",
      "value": "ㄴ"
    },
    {
      "ref": "rel.starts_at",
      "value": "점 ㄱ에서 시작"
    },
    {
      "ref": "rel.passes_through",
      "value": "점 ㄴ을 지남"
    },
    {
      "ref": "rel.direction_right",
      "value": "오른쪽으로 길게 늘어남"
    }
  ],
  "target": {
    "ref": "answer.target",
    "type": "반직선"
  },
  "method": "shape_matching",
  "plan": [
    "시작점과 지나가는 점, 방향을 확인한다.",
    "조건에 맞는 선의 종류를 고른다."
  ],
  "steps": [
    {
      "id": "step.1",
      "expr": "시작점 = ㄱ",
      "value": "ㄱ"
    },
    {
      "id": "step.2",
      "expr": "지나는 점 = ㄴ",
      "value": "ㄴ"
    },
    {
      "id": "step.3",
      "expr": "방향 = 오른쪽",
      "value": "오른쪽"
    }
  ],
  "checks": [
    {
      "id": "check.1",
      "expr": "시작점이 ㄱ인지 확인",
      "expected": "ㄱ",
      "actual": "ㄱ",
      "pass": true
    },
    {
      "id": "check.2",
      "expr": "ㄴ을 지나는지 확인",
      "expected": "ㄴ",
      "actual": "ㄴ",
      "pass": true
    },
    {
      "id": "check.3",
      "expr": "오른쪽으로 길게 늘어나는지 확인",
      "expected": "오른쪽",
      "actual": "오른쪽",
      "pass": true
    }
  ],
  "answer": {
    "blanks": [],
    "choices": [],
    "answer_key": [],
    "target": {
      "type": "반직선",
      "description": "점 ㄱ에서 시작하여 점 ㄴ을 지나 오른쪽으로 길게 늘인 곧은 선"
    },
    "value": 0,
    "unit": ""
  }
}
