{
  "schema": "modu.solvable.v1.1",
  "problem_id": "S3_초등_3_008662",
  "problem_type": "geometry_multiple_choice",
  "inputs": {
    "total_ticks": 4,
    "target_label": "지름",
    "target_ticks": 1,
    "target_count": 1,
    "unit": ""
  },
  "given": [
    {
      "ref": "obj.circle",
      "value": {
        "type": "circle"
      }
    },
    {
      "ref": "obj.segment.gn",
      "value": {
        "label": "ㄱㄴ"
      }
    },
    {
      "ref": "obj.segment.dl",
      "value": {
        "label": "ㄷㄹ"
      }
    },
    {
      "ref": "obj.segment.mb",
      "value": {
        "label": "ㅁㅂ"
      }
    },
    {
      "ref": "obj.segment.sj",
      "value": {
        "label": "ㅅㅈ"
      }
    }
  ],
  "target": {
    "ref": "answer.target",
    "type": "choice"
  },
  "method": "diagram_classification",
  "plan": [
    "그림에서 원의 중심을 지나는 선분을 찾는다.",
    "그 선분과 같은 표기를 가진 보기를 고른다."
  ],
  "steps": [
    {
      "id": "step.1",
      "expr": "중심을 지나는 선분 확인",
      "value": "ㄷㄹ"
    },
    {
      "id": "step.2",
      "expr": "해당 보기 번호 확인",
      "value": 2
    }
  ],
  "checks": [
    {
      "id": "check.1",
      "expr": "선분 ㄷㄹ이 중심을 지나는가",
      "expected": true,
      "actual": true,
      "pass": true
    },
    {
      "id": "check.2",
      "expr": "선택한 보기가 ②인가",
      "expected": 2,
      "actual": 2,
      "pass": true
    }
  ],
  "answer": {
    "blanks": [],
    "choices": [],
    "answer_key": [],
    "target": {
      "type": "choice",
      "description": "원의 지름에 해당하는 보기"
    },
    "value": 2,
    "unit": ""
  }
}
