{
  "schema": "modu.solvable.v1.1",
  "problem_id": "S3_초등_3_008594",
  "problem_type": "compare_remainders",
  "inputs": {
    "total_ticks": 0,
    "target_label": "㉠",
    "target_ticks": 0,
    "target_count": 1,
    "unit": ""
  },
  "given": [
    {
      "ref": "obj.choice.a",
      "value": {
        "dividend": 515,
        "divisor": 4
      }
    },
    {
      "ref": "obj.choice.b",
      "value": {
        "dividend": 516,
        "divisor": 5
      }
    },
    {
      "ref": "obj.remainder.a",
      "value": 3
    },
    {
      "ref": "obj.remainder.b",
      "value": 1
    }
  ],
  "target": {
    "ref": "answer.target",
    "type": "choice_label"
  },
  "method": "compare_remainders",
  "plan": [
    "두 나눗셈의 나머지를 확인한다.",
    "나머지의 크기를 비교한다.",
    "더 큰 나머지를 가진 보기의 기호를 답으로 정한다."
  ],
  "steps": [
    {
      "id": "step.1",
      "expr": "515 ÷ 4의 나머지",
      "value": 3
    },
    {
      "id": "step.2",
      "expr": "516 ÷ 5의 나머지",
      "value": 1
    },
    {
      "id": "step.3",
      "expr": "3 > 1",
      "value": true
    },
    {
      "id": "step.4",
      "expr": "나머지가 더 큰 보기",
      "value": "㉠"
    }
  ],
  "checks": [
    {
      "id": "check.1",
      "expr": "515 = 4 × 128 + 3",
      "expected": true,
      "actual": true,
      "pass": true
    },
    {
      "id": "check.2",
      "expr": "516 = 5 × 103 + 1",
      "expected": true,
      "actual": true,
      "pass": true
    }
  ],
  "answer": {
    "blanks": [],
    "choices": [],
    "answer_key": [],
    "target": {
      "type": "choice_label",
      "description": "나머지가 더 큰 보기"
    },
    "value": "㉠",
    "unit": ""
  }
}
