{
  "schema": "modu.solvable.v1.1",
  "problem_id": "S3_초등_3_008802",
  "problem_type": "choice",
  "inputs": {
    "total_ticks": 0,
    "target_label": "정답인 사람",
    "target_ticks": 0,
    "target_count": 1,
    "unit": ""
  },
  "given": [
    {
      "ref": "obj.sweet_potato",
      "value": {
        "name": "고구마"
      }
    },
    {
      "ref": "obj.potato",
      "value": {
        "name": "감자"
      }
    },
    {
      "ref": "obj.sun_gyu",
      "value": {
        "name": "상규"
      }
    },
    {
      "ref": "obj.min_ha",
      "value": {
        "name": "민하"
      }
    }
  ],
  "target": {
    "ref": "answer.target",
    "type": "selected_person"
  },
  "method": "compare_by_scale",
  "plan": [
    "두 사람이 말한 방법이 무게 비교에 적절한지 확인한다.",
    "저울을 이용하는 방법이 올바른지 판단한다."
  ],
  "steps": [
    {
      "id": "step.1",
      "expr": "상규의 방법은 눈으로 크기를 비교하는 방법이다.",
      "value": "부적절"
    },
    {
      "id": "step.2",
      "expr": "민하의 방법은 저울의 양쪽 접시에 각각 올려 무게를 비교하는 방법이다.",
      "value": "적절"
    },
    {
      "id": "step.3",
      "expr": "올바른 사람 선택",
      "value": "민하"
    }
  ],
  "checks": [
    {
      "id": "check.1",
      "expr": "저울을 사용해 무게를 비교하는 방법이 맞는가",
      "expected": true,
      "actual": true,
      "pass": true
    },
    {
      "id": "check.2",
      "expr": "선택된 사람이 민하인가",
      "expected": "민하",
      "actual": "민하",
      "pass": true
    }
  ],
  "answer": {
    "blanks": [],
    "choices": [],
    "answer_key": [],
    "target": {
      "type": "selected_person",
      "description": "고구마와 감자의 무게를 비교하는 올바른 방법을 말한 사람"
    },
    "value": "민하",
    "unit": ""
  }
}
