{
  "schema": "modu.solvable.v1.1",
  "problem_id": "S3_초등_3_008699",
  "problem_type": "geometry_circle_diameter_mcq",
  "inputs": {
    "total_ticks": 4,
    "target_label": "원의 지름을 나타내는 선분",
    "target_ticks": 1,
    "target_count": 1,
    "unit": ""
  },
  "given": [
    {
      "ref": "obj.circle",
      "value": {
        "type": "circle"
      }
    },
    {
      "ref": "obj.segment_top",
      "value": {
        "label_pair": [
          "ㄱ",
          "ㄴ"
        ]
      }
    },
    {
      "ref": "obj.segment_mid",
      "value": {
        "label_pair": [
          "ㄷ",
          "ㄹ"
        ]
      }
    },
    {
      "ref": "obj.segment_bottom",
      "value": {
        "label_pair": [
          "ㅁ",
          "ㅂ"
        ]
      }
    }
  ],
  "target": {
    "ref": "answer.target",
    "type": "multiple_choice"
  },
  "method": "definition_match_check",
  "plan": [
    "원 안의 선분들을 보고 지름의 뜻에 맞는 선분을 찾는다.",
    "보기와 대응되는 선분 이름을 확인한다."
  ],
  "steps": [
    {
      "id": "step.1",
      "expr": "원 안의 선분 후보를 확인한다.",
      "value": 3
    },
    {
      "id": "step.2",
      "expr": "지름에 해당하는 보기 번호를 확인한다.",
      "value": 2
    }
  ],
  "checks": [
    {
      "id": "check.1",
      "expr": "보기 ②가 선분 ㄷㄹ과 대응하는지 확인",
      "expected": 2,
      "actual": 2,
      "pass": true
    }
  ],
  "answer": {
    "blanks": [],
    "choices": [],
    "answer_key": [],
    "target": {
      "type": "multiple_choice",
      "description": "원의 지름을 나타내는 선분"
    },
    "value": 2,
    "unit": ""
  }
}
