{
  "schema": "modu.solvable.v1.1",
  "problem_id": "S3_초등_3_008730",
  "problem_type": "distance_comparison",
  "inputs": {
    "total_ticks": 0,
    "target_label": "상구네 집에서 더 가까운 곳",
    "target_ticks": 0,
    "target_count": 2,
    "unit": "km"
  },
  "given": [
    {
      "ref": "obj.dist_school",
      "value": "13/11 km"
    },
    {
      "ref": "obj.dist_playground",
      "value": "1 3/11 km"
    }
  ],
  "target": {
    "ref": "answer.target",
    "type": "nearest_place"
  },
  "method": "fraction_comparison",
  "plan": [
    "두 거리를 같은 분모로 바꾸어 비교한다.",
    "더 작은 거리에 해당하는 장소를 고른다."
  ],
  "steps": [
    {
      "id": "step.1",
      "expr": "1 3/11 = 14/11",
      "value": "14/11"
    },
    {
      "id": "step.2",
      "expr": "13/11 < 14/11",
      "value": "13/11"
    },
    {
      "id": "step.3",
      "expr": "더 가까운 곳 선택",
      "value": "학교"
    }
  ],
  "checks": [
    {
      "id": "check.1",
      "expr": "13/11과 14/11의 대소 비교",
      "expected": "13/11 < 14/11",
      "actual": "13/11 < 14/11",
      "pass": true
    },
    {
      "id": "check.2",
      "expr": "더 가까운 장소가 학교인지 확인",
      "expected": "학교",
      "actual": "학교",
      "pass": true
    }
  ],
  "answer": {
    "blanks": [],
    "choices": [],
    "answer_key": [],
    "target": {
      "type": "nearest_place",
      "description": "상구네 집에서 더 가까운 곳"
    },
    "value": "학교",
    "unit": ""
  }
}
