{
  "schema": "modu.solvable.v1.1",
  "problem_id": "S3_초등_3_008681",
  "problem_type": "선택형_도형_비교",
  "inputs": {
    "total_ticks": 3,
    "target_label": "3번",
    "target_ticks": 3,
    "target_count": 1,
    "unit": ""
  },
  "given": [
    {
      "ref": "obj.radius",
      "value": {
        "value": 3,
        "unit": "cm"
      }
    },
    {
      "ref": "obj.options",
      "value": {
        "count": 3
      }
    }
  ],
  "target": {
    "ref": "answer.target",
    "type": "selected_figure"
  },
  "method": "visual_comparison",
  "plan": [
    "각 보기의 컴퍼스 벌림을 자의 눈금과 비교한다.",
    "3 cm와 같은 벌림을 가진 3번 그림을 찾는다."
  ],
  "steps": [
    {
      "id": "step.1",
      "expr": "보기 1, 2, 3의 벌림 정도를 자 눈금과 비교한다.",
      "value": "3번의 벌림이 3 cm임"
    },
    {
      "id": "step.2",
      "expr": "3 cm에 해당하는 보기 선택",
      "value": "3번"
    }
  ],
  "checks": [
    {
      "id": "check.1",
      "expr": "선택된 그림의 벌림이 3 cm와 일치하는가",
      "expected": "3번",
      "actual": "3번",
      "pass": true
    }
  ],
  "answer": {
    "blanks": [],
    "choices": [
      {
        "id": "choice.1",
        "label": "1",
        "text": "1번",
        "source_refs": []
      },
      {
        "id": "choice.2",
        "label": "2",
        "text": "2번",
        "source_refs": []
      },
      {
        "id": "choice.3",
        "label": "3",
        "text": "3번",
        "source_refs": []
      }
    ],
    "answer_key": [
      {
        "id": "choice.3",
        "value": "3번"
      }
    ],
    "target": {
      "type": "selected_figure",
      "description": "반지름이 3 cm인 원을 그리도록 컴퍼스를 벌린 그림"
    },
    "value": "3번",
    "unit": "",
    "presentation": {
      "mode": "choice",
      "editor_managed": true,
      "review": {
        "mode": "choice",
        "status": "verified",
        "note": "",
        "answers": [
          {
            "value": "3번"
          }
        ],
        "choices": [
          {
            "id": "choice.1",
            "text": "1번",
            "correct": false,
            "label": "1",
            "sourceRefs": []
          },
          {
            "id": "choice.2",
            "text": "2번",
            "correct": false,
            "label": "2",
            "sourceRefs": []
          },
          {
            "id": "choice.3",
            "text": "3번",
            "correct": true,
            "label": "3",
            "sourceRefs": []
          }
        ]
      }
    }
  }
}
