{
  "schema": "modu.solvable.v1.1",
  "problem_id": "S3_초등_3_009063",
  "problem_type": "도형_판별",
  "inputs": {
    "total_ticks": 5,
    "target_label": "직각인 사각형",
    "target_ticks": 2,
    "target_count": 2,
    "unit": ""
  },
  "given": [
    {
      "ref": "obj.choice.a",
      "value": {
        "label": "가"
      }
    },
    {
      "ref": "obj.choice.b",
      "value": {
        "label": "나"
      }
    },
    {
      "ref": "obj.choice.c",
      "value": {
        "label": "다"
      }
    },
    {
      "ref": "obj.choice.d",
      "value": {
        "label": "라"
      }
    },
    {
      "ref": "obj.choice.e",
      "value": {
        "label": "마"
      }
    }
  ],
  "target": {
    "ref": "answer.target",
    "type": "selected_shapes"
  },
  "method": "shape_comparison",
  "plan": [
    "각 도형의 네 각이 모두 직각인지 확인합니다.",
    "조건에 맞는 도형을 고릅니다."
  ],
  "steps": [
    {
      "id": "step.1",
      "expr": "가, 나, 다, 라, 마 중 직각 사각형 찾기",
      "value": [
        "다",
        "라"
      ]
    }
  ],
  "checks": [
    {
      "id": "check.1",
      "expr": "선택된 도형이 직각 사각형인지 확인",
      "expected": [
        "다",
        "라"
      ],
      "actual": [
        "다",
        "라"
      ],
      "pass": true
    }
  ],
  "answer": {
    "blanks": [],
    "choices": [],
    "answer_key": [],
    "target": {
      "type": "selected_shapes",
      "description": "네 각이 모두 직각인 사각형"
    },
    "value": 2,
    "unit": ""
  }
}
