{
  "schema": "modu.solvable.v1.1",
  "problem_id": "S3_초등_3_008684",
  "problem_type": "circle_radius_relation",
  "inputs": {
    "total_ticks": 2,
    "target_label": "같습니다",
    "target_ticks": 1,
    "target_count": 1,
    "unit": ""
  },
  "given": [
    {
      "ref": "obj.center",
      "value": {
        "role": "center",
        "description": "누름 못이 꽂힌 점"
      }
    },
    {
      "ref": "obj.points_on_circle",
      "value": {
        "count": 4,
        "description": "원 위에 찍은 4개의 점"
      }
    }
  ],
  "target": {
    "ref": "answer.target",
    "type": "choice_word"
  },
  "method": "circle_property",
  "plan": [
    "원의 중심에서 원 위의 점까지의 거리가 모두 같은지 확인한다.",
    "보기 중 알맞은 말(같습니다)을 고른다."
  ],
  "steps": [
    {
      "id": "step.1",
      "expr": "원 위의 각 점은 중심에서 같은 반지름만큼 떨어져 있다.",
      "value": "같다"
    },
    {
      "id": "step.2",
      "expr": "4개의 점에 대한 거리 관계를 비교한다.",
      "value": "같습니다"
    }
  ],
  "checks": [
    {
      "id": "check.1",
      "expr": "중심에서 각 점까지의 거리가 동일한가",
      "expected": "같습니다",
      "actual": "같습니다",
      "pass": true
    }
  ],
  "answer": {
    "blanks": [],
    "choices": [
      "같습니다",
      "다릅니다"
    ],
    "answer_key": [
      "같습니다"
    ],
    "target": {
      "type": "choice_word",
      "description": "누름 못이 꽂힌 점에서 원 위에 찍은 4개의 점까지의 길이 관계"
    },
    "value": "같습니다",
    "unit": ""
  }
}
